======================================================= MySql HOL - 7 ====================================================================

mysql> USE pubs;
Database changed

mysql> CREATE TABLE MY_EMPLOYEE(ID INT(4) PRIMARY KEY AUTO_INCREMENT,
    -> LAST_NAME VARCHAR(25),FIRST_NAME VARCHAR(25),USERID  VARCHAR(8),SALARY FLOAT(9,2));
Query OK, 0 rows affected, 2 warnings (0.05 sec)

mysql> DESC MY_EMPLOYEE;
+------------+-------------+------+-----+---------+----------------+
| Field      | Type        | Null | Key | Default | Extra          |
+------------+-------------+------+-----+---------+----------------+
| ID         | int         | NO   | PRI | NULL    | auto_increment |
| LAST_NAME  | varchar(25) | YES  |     | NULL    |                |
| FIRST_NAME | varchar(25) | YES  |     | NULL    |                |
| USERID     | varchar(8)  | YES  |     | NULL    |                |
| SALARY     | float(9,2)  | YES  |     | NULL    |                |
+------------+-------------+------+-----+---------+----------------+
5 rows in set (0.00 sec)

mysql> INSERT INTO MY_EMPLOYEE VALUES 
    -> (1, 'Patel', 'Ralph', 'rpatel', 795);
Query OK, 1 row affected (0.02 sec)

mysql> INSERT INTO MY_EMPLOYEE (ID, LAST_NAME, FIRST_NAME, USERID, SALARY)
    -> VALUES (2, 'Dancs', 'Betty', 'bdancs', 860);
Query OK, 1 row affected (0.01 sec)

mysql> SELECT * FROM MY_EMPLOYEE
    -> ;
+----+-----------+------------+--------+--------+
| ID | LAST_NAME | FIRST_NAME | USERID | SALARY |
+----+-----------+------------+--------+--------+
|  1 | Patel     | Ralph      | rpatel | 795.00 |
|  2 | Dancs     | Betty      | bdancs | 860.00 |
+----+-----------+------------+--------+--------+
2 rows in set (0.00 sec)

mysql> \. D:\loadEmp.sql
Query OK, 1 row affected (0.01 sec)

Query OK, 1 row affected (0.00 sec)

mysql> SELECT * FROM MY_EMPLOYEE;
+----+-----------+------------+-----------+---------+
| ID | LAST_NAME | FIRST_NAME | USERID    | SALARY  |
+----+-----------+------------+-----------+---------+
|  1 | Patel     | Ralph      | rpatel    |  795.00 |
|  2 | Dancs     | Betty      | bdancs    |  860.00 |
|  3 | Biri      | Ben        | bbiri     | 1100.00 |
|  4 | Newman    | Chad       | cnewman   |  750.00 |
+----+-----------+------------+-----------+---------+
4 rows in set (0.00 sec)

mysql> SET autocommit = 0;
Query OK, 0 rows affected (0.00 sec)

mysql> START TRANSACTION;
Query OK, 0 rows affected (0.00 sec)

mysql> UPDATE MY_EMPLOYEE SET FIRST_NAME = 'DEXTER' WHERE ID = 3;
Query OK, 1 row affected (0.00 sec)
Rows matched: 1  Changed: 1  Warnings: 0

mysql> UPDATE MY_EMPLOYEE SET SALARY = 1000 WHERE SALARY < 900;
Query OK, 3 rows affected (0.00 sec)
Rows matched: 3  Changed: 3  Warnings: 0

mysql> SELECT * FROM MY_EMPLOYEE;
+----+-----------+------------+---------+---------+
| ID | LAST_NAME | FIRST_NAME | USERID  | SALARY  |
+----+-----------+------------+---------+---------+
|  1 | Patel     | Ralph      | rpatel  | 1000.00 |
|  2 | Dancs     | Betty      | bdancs  | 1000.00 |
|  3 | Biri      | DEXTER     | bbiri   | 1100.00 |
|  4 | Newman    | Chad       | cnewman | 1000.00 |
+----+-----------+------------+---------+---------+
4 rows in set (0.00 sec)

mysql> DELETE FROM MY_EMPLOYEE WHERE FIRST_NAME = 'Betty' AND LAST_NAME = 'Dancs';
Query OK, 1 row affected (0.00 sec)

mysql> SELECT * FROM MY_EMPLOYEE;
+----+-----------+------------+---------+---------+
| ID | LAST_NAME | FIRST_NAME | USERID  | SALARY  |
+----+-----------+------------+---------+---------+
|  1 | Patel     | Ralph      | rpatel  | 1000.00 |
|  3 | Biri      | DEXTER     | bbiri   | 1100.00 |
|  4 | Newman    | Chad       | cnewman | 1000.00 |
+----+-----------+------------+---------+---------+
3 rows in set (0.00 sec)

mysql> COMMIT;
Query OK, 0 rows affected (0.01 sec)

mysql> \. D:\loadEmp.sql
ERROR 1062 (23000): Duplicate entry '3' for key 'my_employee.PRIMARY'
ERROR 1062 (23000): Duplicate entry '4' for key 'my_employee.PRIMARY'
ERROR 1406 (22001): Data too long for column 'USERID' at row 1
mysql> SELECT * FROM MY_EMPLOYEE;
+----+-----------+------------+---------+---------+
| ID | LAST_NAME | FIRST_NAME | USERID  | SALARY  |
+----+-----------+------------+---------+---------+
|  1 | Patel     | Ralph      | rpatel  | 1000.00 |
|  3 | Biri      | DEXTER     | bbiri   | 1100.00 |
|  4 | Newman    | Chad       | cnewman | 1000.00 |
+----+-----------+------------+---------+---------+
3 rows in set (0.00 sec)

mysql> -- To add record where id = 5 we need to update the length of USERID
mysql> SAVEPOINT MySqlHOL7Savepoint;
Query OK, 0 rows affected (0.00 sec)

mysql> DELETE FROM MY_EMPLOYEE;
Query OK, 3 rows affected (0.00 sec)

mysql> SELECT * FROM MY_EMPLOYEE;
Empty set (0.00 sec)

mysql> ROLLBACK TO SAVEPOINT MySqlHOL7Savepoint;
Query OK, 0 rows affected (0.00 sec)

mysql> SELECT * FROM MY_EMPLOYEE;
+----+-----------+------------+---------+---------+
| ID | LAST_NAME | FIRST_NAME | USERID  | SALARY  |
+----+-----------+------------+---------+---------+
|  1 | Patel     | Ralph      | rpatel  | 1000.00 |
|  3 | Biri      | DEXTER     | bbiri   | 1100.00 |
|  4 | Newman    | Chad       | cnewman | 1000.00 |
+----+-----------+------------+---------+---------+
3 rows in set (0.00 sec)

mysql> COMMIT;
Query OK, 0 rows affected (0.01 sec)

mysql> SET AUTOCOMMIT = 1;
Query OK, 0 rows affected (0.00 sec)
